### ISSUE TITLE
HTTP post with post data

### ISSUE THREAD

**Issue by jonjow** [uNetworking/uWebSockets#1526]
Hi

In C++ I have set up uWS::App in two threads, one for WebSockets and the other for HTTP.

In the HTTP thread, I am using both .get and .post which work when no post data is passed but fail when it is.

In c++
```
    }).post("/*", [](auto* res, uWS::HttpRequest* req) {
        res->writeHeader("Access-Control-Allow-Origin", "*");
        res->writeHeader("Content-Type", "application/json");

        res->end("Success!");
    }
```

This works with javascript (serviceAPI is exported from axios.create)
`serviceAPI.post(SERVICE_ROUTE_TEST_PLAN).then(response => console.log(response))`

But it fails with postData
```
const postData = {
  command: TRIGGER_BUTTON_RUN, 
  payload: {
    id: dataId,
    selected: selected
  }
}
serviceAPI.post(SERVICE_ROUTE_TEST_PLAN, { postData }).then(response => console.log(response))

```

![image](https://user-images.githubusercontent.com/9991364/203545598-5b6ee647-1140-4844-9821-5746384dc311.png)

Any ideas?

**Comment by uNetworkingAB** [comment]
You can play with the Crc32 example to see how post works

**Comment by jonjow** [comment]
> You can play with the Crc32 example to see how post works

I've used the crc32 example and have the same issue. After adding the postData it does not enter the uWS::App().post handler.

See the example below.

```
const postData {
name: "MyName"
}
axios.post(`http://127.0.0.1:3000/users`, { postData })
  .then(res => {
    console.log(res);
    console.log(res.data);
  })
```

If I remove the postData parameters it will enter the handler and respond.

**Comment by uNetworkingAB** [comment]
I just tried your example and it worked straight away:

 --- /users --- 
accept: application/json, text/plain, */*
content-type: application/json
user-agent: axios/1.2.0
content-length: 30
accept-encoding: gzip, deflate, br
host: 127.0.0.1:3000
connection: keep-alive

**Comment by jonjow** [comment]
Did you try with postData like this?

```
      const postData = {
        name: "MyName"
      }
      axios.post(`http://127.0.0.1:9002/users`, { postData })
        .then(res => {
          console.log(res);
          console.log(res.data);
      })
```

**Comment by uNetworkingAB** [comment]
yes. it works

**Comment by jonjow** [comment]
I am using Windows with uwebsockets version 20.14.0 installed with vcpkg. Which version are you using?

**Comment by uNetworkingAB** [comment]
You can show me a wireshark capture of the failing http request

**Comment by jonjow** [comment]
See below

```
246	3.340444	127.0.0.1	127.0.0.1	TCP	44	9002 → 52705 [ACK] Seq=2 Ack=537 Win=2619648 Len=0
245	3.340432	127.0.0.1	127.0.0.1	TCP	44	52705 → 9002 [FIN, ACK] Seq=536 Ack=2 Win=2619648 Len=0
244	3.340389	127.0.0.1	127.0.0.1	TCP	44	52705 → 9002 [ACK] Seq=536 Ack=2 Win=2619648 Len=0
243	3.340380	127.0.0.1	127.0.0.1	TCP	44	9002 → 52705 [FIN, ACK] Seq=1 Ack=536 Win=2619648 Len=0
242	3.340301	127.0.0.1	127.0.0.1	TCP	44	9002 → 52705 [ACK] Seq=1 Ack=536 Win=2619648 Len=0
241	3.340292	127.0.0.1	127.0.0.1	HTTP	579	OPTIONS /users HTTP/1.1 
240	3.340206	127.0.0.1	127.0.0.1	TCP	44	52705 → 9002 [ACK] Seq=1 Ack=1 Win=2619648 Len=0
239	3.340173	127.0.0.1	127.0.0.1	TCP	56	9002 → 52705 [SYN, ACK] Seq=0 Ack=1 Win=65535 Len=0 MSS=65495 WS=256 SACK_PERM
238	3.340136	127.0.0.1	127.0.0.1	TCP	56	52705 → 9002 [SYN] Seq=0 Win=65535 Len=0 MSS=65495 WS=256 SACK_PERM
237	3.275015	127.0.0.1	127.0.0.1	TCP	44	9002 → 52704 [ACK] Seq=2 Ack=537 Win=2619648 Len=0
236	3.275008	127.0.0.1	127.0.0.1	TCP	44	52704 → 9002 [FIN, ACK] Seq=536 Ack=2 Win=2619648 Len=0
235	3.274957	127.0.0.1	127.0.0.1	TCP	44	52704 → 9002 [ACK] Seq=536 Ack=2 Win=2619648 Len=0
234	3.274939	127.0.0.1	127.0.0.1	TCP	44	9002 → 52704 [FIN, ACK] Seq=1 Ack=536 Win=2619648 Len=0
233	3.274884	127.0.0.1	127.0.0.1	TCP	44	9002 → 52704 [ACK] Seq=1 Ack=536 Win=2619648 Len=0
232	3.274875	127.0.0.1	127.0.0.1	HTTP	579	OPTIONS /users HTTP/1.1 
231	3.274776	127.0.0.1	127.0.0.1	TCP	44	52704 → 9002 [ACK] Seq=1 Ack=1 Win=2619648 Len=0
230	3.274760	127.0.0.1	127.0.0.1	TCP	56	9002 → 52704 [SYN, ACK] Seq=0 Ack=1 Win=65535 Len=0 MSS=65495 WS=256 SACK_PERM
229	3.274726	127.0.0.1	127.0.0.1	TCP	56	52704 → 9002 [SYN] Seq=0 Win=65535 Len=0 MSS=65495 WS=256 SACK_PERM
```

**Comment by gillsoftab** [comment]
Does this work?
If not try sending content-type so a simple request is triggered instead of a preflight request (i.e. application/x-www-form-urlencoded, multipart/form-data, or text/plain).
```
uWS::App().options("/*", [](auto* res, uWS::HttpRequest* req) {
        res->writeHeader("Access-Control-Allow-Origin", "*");
        res->writeHeader("Access-Control-Allow-Headers", "Content-Type");
        res->end();
 }).post("/*", [](auto* res, uWS::HttpRequest* req) {
        res->writeHeader("Access-Control-Allow-Origin", "*");
        res->writeHeader("Content-Type", "application/json");
        res->end("Success!");
}).listen(9002, [](auto *listen_socket) {
        if (listen_socket) {
                std::cerr << "Listening on port " << 9002 << std::endl;
        }
}).run();
```
**And then called with:**
```
const postData = {
  name: "MyName"
}
axios.post("http://127.0.0.1:9002/users", { postData })
        .then(res => {
          console.log(res);
          console.log(res.data);
})
```

**Comment by jonjow** [comment]
> @jonjow Does this work? If not try sending content-type so a simple request is triggered instead of a preflight request (i.e. application/x-www-form-urlencoded, multipart/form-data, or text/plain).
> 
> ```
> uWS::App().options("/*", [](auto* res, uWS::HttpRequest* req) {
>         res->writeHeader("Access-Control-Allow-Origin", "*");
>         res->writeHeader("Access-Control-Allow-Headers", "Content-Type");
>         res->end();
>  }).post("/*", [](auto* res, uWS::HttpRequest* req) {
>         res->writeHeader("Access-Control-Allow-Origin", "*");
>         res->writeHeader("Content-Type", "application/json");
>         res->end("{\"status\":\"Success!\"}");
> }).listen(9002, [](auto *listen_socket) {
>         if (listen_socket) {
>                 std::cerr << "Listening on port " << 9002 << std::endl;
>         }
> }).run();
> ```
> 
> **And then called with:**
> 
> ```
> const postData = {
>   name: "MyName"
> }
> axios.post("http://127.0.0.1:9002/users", { postData })
>         .then(res => {
>           console.log(res);
>           console.log(res.data);
> })
> ```

Very nice spot, thank you for your help and for providing a fantastic C++ WebSocket implementation.

**Comment by gillsoftab** [comment]
@jonjow it's @uNetworkingAB that is providing the fantastic C++ WebSocket implementation. I was just explaining the cause of your issue :)

**Comment by uNetworkingAB** [comment]
Error reporting needs to improve - the server sound respond with proper 500 statuses, that's an improvement to make
